{
  "protocol_version": "reasonbraid/0.4",
  "operation": "thread.create",
  "request_id": "req_018f2e6c-1b2e-7000-8000-000000000004",
  "idempotency_key": "client-key-0001",
  "expected_aggregate_version": null,
  "body": {
    "title": "Resolve the budget-signoff ambiguity",
    "visibility": "tenant"
  },
  "client_context": {
    "correlation_id": "corr_018f2e6c-1b2e-7000-8000-000000000005",
    "causation_id": null
  }
}
